input,output
"What is Python?","Python is a high-level, interpreted programming language known for its clear syntax and readability. It supports multiple programming paradigms including procedural, object-oriented, and functional programming."
"Explain machine learning","Machine learning is a subset of artificial intelligence that enables systems to learn and improve from experience without being explicitly programmed. It focuses on the development of computer programs that can access data and use it to learn for themselves."
"What are the benefits of cloud computing?","Cloud computing offers several benefits including cost savings, scalability, flexibility, automatic updates, increased collaboration, disaster recovery, and the ability to work from anywhere with an internet connection."
"How does blockchain work?","Blockchain is a distributed ledger technology that maintains a continuously growing list of records called blocks. Each block contains a cryptographic hash of the previous block, a timestamp, and transaction data, making it resistant to modification."
"What is the difference between AI and ML?","AI (Artificial Intelligence) is the broader concept of machines being able to carry out tasks in a way that we would consider smart. ML (Machine Learning) is a subset of AI that focuses on the idea that systems can learn from data, identify patterns, and make decisions with minimal human intervention."
